{
  "id": "hello-names",
  "name": "人名点名",
  "version": "0.1.0",
  "apiVersion": 1,
  "platforms": [
    "linux",
    "windows"
  ],
  "operations": [
    {
      "name": "count-names",
      "description": "统计选区里出现了多少次给定人名",
      "inputSchema": {
        "type": "object",
        "required": [
          "names"
        ],
        "properties": {
          "names": {
            "type": "array",
            "items": {
              "type": "string"
            }
          },
          "selection": {
            "type": "string"
          }
        }
      },
      "outputSchema": {
        "type": "object",
        "required": [
          "counts"
        ],
        "properties": {
          "counts": {
            "type": "object"
          }
        }
      },
      "triggers": [
        "editor.idle"
      ]
    }
  ],
  "requestedCapabilities": [
    {
      "kind": "readSelection"
    },
    {
      "kind": "log"
    }
  ],
  "wasmBase64": "AGFzbQEAAAABLQhgAn9/AX9gAX8Bf2ACf38AYAR/f39/AX9gAn9/AX5gAX8AYAN/f38Bf2AAAAMlJAEFAgECAgICAAAABgMAAQAAAAMAAAEBAQAAAQABAQEAAgQEBwQFAXABAgIFAwEAAQYLAn8BQQALfwFBAAsHGwIOcGx1Z2luX2V4ZWN1dGUAIgZtZW1vcnkCAAgBIwkHAQBBAQsBHgwBMgqKISQNACAAQRRrKAIQQQF2C0wBAn8/ACIBQRB0QQ9qQXBxIgIgAEkEQCABIAAgAmtB//8DakGAgHxxQRB2IgIgASACShtAAEEASARAIAJAAEEASARAAAsLCyAAJAALCQAgACABNgIACzQBAn8gAEH8////A0sEQAALIwAhASMAQQRqIgIgAEETakFwcUEEayIAahABIAEgABACIAILCQAgACABNgIECwkAIAAgATYCCAsJACAAIAE2AgwLCQAgACABNgIQCzoBAn8gAEHs////A0sEQAALIABBEGoQAyIDQQRrIgJBABAEIAJBABAFIAIgARAGIAIgABAHIANBEGoLQAEEf0HwCCECIAAQAEEBdCIDIAEQAEEBdCIEaiIFBEAgBUECEAgiAiAAIAP8CgAAIAIgA2ogASAE/AoAAAsgAgsaACAAEAAgAU0EQEF/DwsgACABQQF0ai8BAAuCAQECfyABQQAgAUEAShsiAyAAEAAiASABIANKGyIDIAJBACACQQBKGyICIAEgASACShsiAiACIANKG0EBdCEEIAMgAiACIANIG0EBdCICIARrIgNFBEBB8AgPCyAERSACIAFBAXRGcQRAIAAPCyADQQIQCCIBIAAgBGogA/wKAAAgAQtJAQF/IAAgAUEBdGohAQNAIAMiAEEBayEDIAAEQCABLwEAIgAgAi8BACIERwRAIAAgBGsPCyABQQJqIQEgAkECaiECDAELC0EACzoBAX8gACABRgRAQQEPCyABRSAARXIEQEEADwsgABAAIQIgARAAIAJHBEBBAA8LIABBACABIAIQDEULGQAgAEEJRiAAQSBGciAAQQpGciAAQQ1GcgviAQEEf0HQCCABEAlB0AgQCSEEA0AgABAAIANKBEAgACADEAohASACBEAgBQRAQQAhBQUgAUHcAEYEQEEBIQUFIAJBACABQSJHGyECCwsgA0EBaiEDDAILIAFBIkYEQCAEEAAgA2ogABAATAR/IAAgAyAEEAAgA2oQCyAEEA0FQQALBEAgBBAAIANqIQEDQCAAEAAgAUoEfyAAIAEQChAOBUEACwRAIAFBAWohAQwBCwsgABAAIAFKBH8gACABEApBOkYFQQALBEAgAUEBag8LC0EBIQILIANBAWohAwwBCwtBfwsoAQF/AkACQAJAIwFBAWsOAgECAAsAC0H/////ByECCyAAIAEgAhALC18BA38gAUEBaiECA0AgABAAIAJKBEAgACACEAohAyAEBEBBACEEBSADQdwARgRAQQEhBAUgA0EiRgRAIAAgASACQQFqEAsPCwsLIAJBAWohAgwBCwtBASQBIAAgARAQC54BAQV/IAEhBANAIAAQACAESgRAIAAgBBAKIQUgBgRAIAgEQEEAIQgFIAVB3ABGBEBBASEIBSAGQQAgBUEiRxshBgsLIARBAWohBAwCCyAFQSJGBEBBASEGBSACIAVGBEAgB0EBaiEHBSADIAVGBEAgB0EBayIHRQRAIAAgASAEQQFqEAsPCwsLCyAEQQFqIQQMAQsLQQEkASAAIAEQEAvEAQECfwNAIAAQACABSgR/IAAgARAKEA4FQQALBEAgAUEBaiEBDAELCyAAEAAgAUwEQEHwCA8LIAAgARAKIgJBIkYEQCAAIAEQEQ8LIAJB+wBGBEAgACABQfsAQf0AEBIPCyACQdsARgRAIAAgAUHbAEHdABASDwsgASECA0AgABAAIAJKBH9BASAAIAIQCiIDQd0ARkEBIANB/QBGQQEgA0EsRiADEA4bGxsFQQELRQRAIAJBAWohAgwBCwsgACABIAIQCwsaACAAIAEQDyIBQQBIBEBB8AgPCyAAIAEQEws/AQN/AkACQAJAIwFBAWsOAgECAAsAC0F/IQELQQIgAUEASiIDdEECEAgiAiAAOwEAIAMEQCACIAE7AQILIAIL/wIBBn8gABAAIgFFBEBBAA8LIAAiAi8BACEAA0ACfyAAQYABckGgAUYgAEEJa0EETXIgAEGALUkNABpBASAAQYBAakEKTQ0AGkEBIABBgC1GIABBqMAARnIgAEGpwABGIABBr8AARnJyIABB38AARiAAQYDgAEZyIABB//0DRnJyDQAaQQALBEAgAkECaiICLwEAIQAgAUEBayEBDAELC0EBIQMgAEErRiAAQS1GcgR/IAFBAWsiAUUEQEEADwtBf0EBIABBLUYbIQMgAkECaiICLwEABSAAC0EwRiABQQJKcQR/IAIvAQJBIHJB+ABGBUEACwRAIAJBBGohAiABQQJrIQELIAFBAWshBQNAIAEiAEEBayEBIAAEQAJAIAIvAQAiAEEwayIGIABBN2sgAEHXAGsgACAAQeEAa0EZTRsgAEHBAGtBGU0bIAZBCkkbIgBBEE8EQCABIAVGBEBBAA8LDAELIARBBHQgAGohBCACQQJqIQIMAgsLCyADIARsC5ICAQN/IAAQAEECSARAQfAIDwsgAEEBIAAQAEEBaxALIQNB8AghAANAIAMQACABSgRAAn8gAyABEAoiAkHcAEcEf0EBBSADEAAgAUEBakwLBEBBASQBIAAgAhAVEAkMAQsgAyABQQFqIgEQCiICQSJGBH8gAEHQCBAJBSACQdwARgR/IABBkAkQCQUgAkHuAEYEfyAAQbAJEAkFIAJB8gBGBH8gAEHQCRAJBSACQfQARgR/IABB8AkQCQUgAkH1AEYEfyADEAAgAUEEakoFQQALBEAgAyABQQFqIAFBBWoQCxAWIQJBASQBIAFBBGohAQVBASQBCyAAIAIQFRAJCwsLCwsLIQAgAUEBaiEBDAELCyAACyYAIAAgARAUIgAQAAR/IABBABAKQSJHBUEBCwRAQfAIDwsgABAXC6YBAQV/IAFB7P///wNLBEAACyAAQRBrIgBBBGsiBCgCACEDIwAgACADakYhBiABQRBqIgJBE2pBcHFBBGshBSACIANLBEAgBgRAIAJB/P///wNLBEAACyAAIAVqEAEgBCAFEAIFIAUgA0EBdCICIAIgBUkbEAMiAiAAIAP8CgAAIAIhAAsFIAYEQCAAIAVqJAAgBCAFEAILCyAAQQRrIAEQByAAQRBqC5IDAQp/IABBsAsQFCEBQRBBBBAIIgdBABACIAdBABAEIAdBABAFIAdBABAGQSBBARAIIgBBAEEg/AsAIAcgABACIAcgABAEIAdBIBAFIAdBABAGIAEQAAR/IAFBABAKQdsARwVBAQsEQCAHDwtBASEAA0AgARAAIABKBEACQANAIAEQACAASgR/IAEgABAKEA4Ef0EBBSABIAAQCkEsRgsFQQALBEAgAEEBaiEADAELCyABEAAgAEwEf0EBBSABIAAQCkHdAEYLDQAgASAAEApBIkcNACABIAAQESIIEBchAyAHKAIMIgRBAWoiBSAHKAIIIgJBAnZLBEAgBUH/////AEsEQAALIAIgBygCACIGQfz///8DIAJBAXQiCSAJQfz///8DTxsiCUEIIAUgBUEITRtBAnQiCiAJIApLGyIJEBkiCmpBACAJIAJr/AsAIAYgCkcEQCAHIAo2AgAgByAKNgIECyAHIAk2AggLIAcoAgQgBEECdGogAzYCACAHIAUQBiAIEAAgAGohAAwCCwsLIAcLmQEBBX8gARAARQRAQQAPCwNAIAAQACADTgRAAkBBACECAkAgARAAIgVFDQBBfyECIAAQACIERQ0AIANBACADQQBKGyICIAQgAiAESBshAiAEIAVrIQMDQCACIANMBEAgACACIAEgBRAMRQ0CIAJBAWohAgwBCwtBfyECCyACQQBIDQAgBkEBaiEGIAEQACACaiEDDAILCwsgBgu1AQEEfyAARQRAQbANDwtBACAAayAAIABBH3ZBAXQiARsiAEEKT0EBaiAAQZDOAE9BA2ogAEHoB09qIABB5ABJGyAAQcCEPU9BBmogAEGAlOvcA09BCGogAEGAwtcvT2ogAEGAreIESRsgAEGgjQZJGyICQQF0IAFqQQIQCCIDIAFqIQQDQCAEIAJBAWsiAkEBdGogAEEKcEEwajsBACAAQQpuIgANAAsgAQRAIANBLTsBAAsgAwuNAgEHfyAAQYALEBghAyAAEBohBEHwCCEBA0AgByAEKAIMSARAIAcgBCgCDE8EQAALIAQoAgQgB0ECdGooAgAiAkUEQAALIAdBAEoEQCABQdALEAkhAQtBACEFQfAIIQADQCACEAAgBUoEQCACIAUQCiIGQSJGBH8gAEHwCxAJBSAGQdwARgR/IABBkAwQCQUgBkEKRgR/IABBsAwQCQUgBkENRgR/IABB0AwQCQUgBkEJRgR/IABB8AwQCQVBASQBIAAgBhAVEAkLCwsLCyEAIAVBAWohBQwBCwsgAUHQCCAAEAlBkA0QCSADIAIQGxAcEAkQCSEBIAdBAWohBwwBCwtBsA4gARAJQfAOEAkLRwECfyAAQaAIEBghAkGwCiEBIABBkAoQFCIAEAAEfyAAQQAQCkH7AEcFQQELRQRAIAAhAQsgAkHQChANBEAgARAdDwtBwA8LsQIBBX8gACABaiEDIAFBAXRBAhAIIgQhAQNAIAAgA0kEQAJAIAAtAAAhBSAAQQFqIQAgBUGAAXEEQCAAIANGDQEgAC0AAEE/cSEGIABBAWohACAFQeABcUHAAUYEQCABIAVBH3FBBnQgBnI7AQAFIAAgA0YNAiAALQAAQT9xIQIgAEEBaiEAIAVB8AFxQeABRgRAIAVBD3FBDHQgBkEGdHIgAnIhAgUgACADRg0DIAAtAABBP3EgBUEHcUESdCAGQQx0ciACQQZ0cnIhAiAAQQFqIQALIAJBgIAESQRAIAEgAjsBAAUgASACQYCABGsiAkEKdkGAsANyIAJB/wdxQYC4A3JBEHRyNgIAIAFBAmohAQsLBSABIAU7AQALIAFBAmohAQwCCwsLIAQgASAEaxAZC6sCAQR/A0AgABAAIANKBEAgACADEAoiBEGAAUgEfyABIAJqIAQ6AAAgAkEBagUgBEGAEEgEfyABIAJqIgUgBEEGdUHAAXI6AAAgBSAEQT9xQYABcjoAASACQQJqBSAEQf+3A0wgBEGAsANOcQR/IAAQACADQQFqSgVBAAsEfyABIAJqIgUgACADQQFqIgMQCkH/B3EgBEH/B3FBCnRyQYCABGoiBEESdkHwAXI6AAAgBSAEQQx2QT9xQYABcjoAASAFIARBBnZBP3FBgAFyOgACIAUgBEE/cUGAAXI6AAMgAkEEagUgASACaiIFIARBDHVB4AFyOgAAIAUgBEEGdUE/cUGAAXI6AAEgBSAEQT9xQYABcjoAAiACQQNqCwsLIQIgA0EBaiEDDAELCwvLAQEDfyAAIAEQHyEEQQEkASAAIAFqIQAgBEHQECgCABEBACEBA0AgARAAIAJKBEAgASACEAoiBEGAAUgEfyADQQFqBSAEQYAQSAR/IANBAmoFIARB/7cDTCAEQYCwA05xBH8gARAAIAJBAWpKBUEACwR/IAJBAWohAiADQQRqBSADQQNqCwsLIQMgAkEBaiECDAELCz8AIgIgACADakH//wNqQRB1IgRIBEAgBCACa0AAQQBIBEBCAA8LCyABIAAQICADrCAArEIghoQLCAAgACABECELBwBB3BAkAAsL/wYyAEGMCAsBLABBmAgLGQIAAAASAAAAbwBwAGUAcgBhAHQAaQBvAG4AQbwICwEcAEHICAsJAgAAAAIAAAAiAEHcCAsBHABB6AgLAQIAQfwICwEcAEGICQsJAgAAAAIAAABcAEGcCQsBHABBqAkLCQIAAAACAAAACgBBvAkLARwAQcgJCwkCAAAAAgAAAA0AQdwJCwEcAEHoCQsJAgAAAAIAAAAJAEH8CQsBHABBiAoLEQIAAAAKAAAAaQBuAHAAdQB0AEGcCgsBHABBqAoLCwIAAAAEAAAAewB9AEG8CgsBLABByAoLHQIAAAAWAAAAYwBvAHUAbgB0AC0AbgBhAG0AZQBzAEHsCgsBLABB+AoLGQIAAAASAAAAcwBlAGwAZQBjAHQAaQBvAG4AQZwLCwEcAEGoCwsRAgAAAAoAAABuAGEAbQBlAHMAQbwLCwEcAEHICwsJAgAAAAIAAAAsAEHcCwsBHABB6AsLCwIAAAAEAAAAXAAiAEH8CwsBHABBiAwLCwIAAAAEAAAAXABcAEGcDAsBHABBqAwLCwIAAAAEAAAAXABuAEG8DAsBHABByAwLCwIAAAAEAAAAXAByAEHcDAsBHABB6AwLCwIAAAAEAAAAXAB0AEH8DAsBHABBiA0LCwIAAAAEAAAAIgA6AEGcDQsBHABBqA0LCQIAAAACAAAAMABBvA0LAVwAQcgNC08CAAAASAAAADAAMQAyADMANAA1ADYANwA4ADkAYQBiAGMAZABlAGYAZwBoAGkAagBrAGwAbQBuAG8AcABxAHIAcwB0AHUAdgB3AHgAeQB6AEGcDgsBPABBqA4LMQIAAAAqAAAAewAiAG8AdQB0AHAAdQB0ACIAOgB7ACIAYwBvAHUAbgB0AHMAIgA6AHsAQdwOCwFMAEHoDgs7AgAAADQAAAB9AH0ALAAiAGwAbwBnAHMAIgA6AFsAIgBoAGUAbABsAG8ALQBuAGEAbQBlAHMAIgBdAH0AQawPCwGMAEG4Dwt3AgAAAHAAAAB7ACIAbwB1AHQAcAB1AHQAIgA6AHsAIgBlAHIAcgBvAHIAIgA6ACIAdQBuAGsAbgBvAHcAbgAgAG8AcABlAHIAYQB0AGkAbwBuACIAfQAsACIAbABvAGcAcwAiADoAWwAiAHcAYQBzAG0AIgBdAH0AQbwQCwEcAEHIEAsJBQAAAAgAAAAB"
}
